<?xml version="1.0" encoding="UTF-8"?>
<bank xmlns:xsi="http://www.w3.org/2001/XMLSchema-instance"
    xsi:noNamespaceSchemaLocation="correct_bank.xsd">
    <accounts>
        <account type="checking" id="a1">
            <balance>4025</balance>
        </account>
        <account type="checking" id="a2">
            <balance>-125</balance>
        </account>
        <account type="checking" id="a3">
            <balance>325</balance>
        </account>
        <account type="savings" id="a4">
            <balance>2500</balance>
            <interest>0.03</interest>
        </account>
        <account type="savings" id="a5">
            <balance>15075</balance>
            <interest>0.03</interest>
        </account>
    </accounts>
    <customers>
        <customer id="c1">
            <name>Ben Richerdson</name>
            <address>Park Drive 2</address>
        </customer>
        <customer id="c2">
            <name>Marc Wretcher</name>
            <address>Mill Drive 75</address>
        </customer>
        <customer id="c3">
            <name>Angel Steady</name>
            <address>Lake Sight 15</address>
        </customer>
    </customers>
    <customer_accounts>
        <customer_account c_id="c1" ac_id="a2" />
        <customer_account c_id="c1" ac_id="a3" />
        <customer_account c_id="c2" ac_id="a4" />
        <customer_account c_id="c3" ac_id="a1" />
        <customer_account c_id="c3" ac_id="a5" />
    </customer_accounts>
</bank>